control_id,control_name,description,evidence_file,severity,EV,AC,AR,PR,UI,VC,VI,VA,RC
MAC-001,MAC active,SELinux or AppArmor enabled,mac/type.txt,Critical,L,L,N,H,N,H,H,H,C
MAC-002,SELinux enforcing,SELinux in enforcing mode not permissive,mac/selinux_status.txt,Critical,L,L,N,H,N,H,H,H,M
MAC-003,AppArmor enabled,AppArmor kernel module loaded and active,mac/apparmor_status.txt,Critical,L,L,N,H,N,H,H,H,M
MAC-004,Mail profiles enforce,Mail profiles in enforce not complain,mac/apparmor_enforcement.txt,High,L,L,N,H,N,H,H,L,M
MAC-005,Restrictive booleans,SELinux mail booleans set correctly,mac/selinux_booleans_mail.txt,Medium,L,H,N,H,N,L,L,L,S
MAC-006,Confined processes,Mail processes in correct SELinux context,mac/selinux_contexts.txt,High,L,H,N,H,N,H,H,L,M
MAC-007,No AVC denial,No recent SELinux denial for mail,mac/selinux_avc_denials.txt,Medium,L,H,P,H,N,L,L,L,M
MAC-008,No AppArmor violations,No recent AppArmor violations,mac/apparmor_violations.txt,Medium,L,H,P,H,N,L,L,L,M
MAC-009,Ports labeled,Mail ports with correct SELinux labels,mac/selinux_ports.txt,Medium,L,H,N,H,N,N,L,L,S
